{
  "canonical_data_version": "1.0",
  "canonical_repository": "https://github.com/flynn33/ASH-Pattern-System",
  "conformance_corpus_version": "1.0",
  "copyright_holder": "James Daley",
  "hashes": {},
  "license": "Apache-2.0",
  "product_identifier": "aps",
  "product_name": "ASH Pattern System",
  "release_tag": "v1.0.0-rc.3",
  "schema_version": "1.0",
  "source_commit": "639e0cfe8b1c276e03cd3351e04311fc845936d1",
  "status": "RELEASE_CANDIDATE",
  "version": "1.0.0-rc.3"
}
